{
  "id": "uk-prince-of-wales",
  "mmsi": null,
  "name": "Prince of Wales",
  "proper": "HMS Prince of Wales",
  "comm": "2019-12-10",
  "pennant": "R09",
  "deck": "P",
  "type": "aircraft",
  "country": "United Kingdom",
  "navy": "Royal Navy",
  "class": "Queen Elizabeth class",
  "home_port": "uk-portsmouth",
  "img": "https://commons.wikimedia.org/wiki/File:VX-23_F-35B_approaches_HMS_Prince_of_Wales.jpg",
  "displacement": {
    "tons": 65000,
    "tonnes": 66043
  },
  "length": {
    "m": 284,
    "ft": 931.8
  },
  "beam": {
    "m": 73,
    "ft": 239.5
  },
  "draught": {
    "m": 11,
    "ft": 36.1
  },
  "speed": {
    "knots": 25,
    "km_h": 46.3
  }
}
