{
  "id": "us-theodore-roosevelt",
  "mmsi": 366984000,
  "name": "Theodore Roosevelt",
  "proper": "USS Theodore Roosevelt",
  "comm": "1986-10-25",
  "pennant": "CVN-71",
  "deck": "71",
  "type": "aircraft",
  "country": "United States",
  "navy": "United States Navy",
  "class": "Nimitz class",
  "home_port": "us-san-diego",
  "img": "https://commons.wikimedia.org/wiki/File:USS_Theodore_Roosevelt_at_sea.jpg",
  "displacement": {
    "tons": 100000,
    "tonnes": 101604.7
  },
  "length": {
    "m": 332.8,
    "ft": 1091.9
  },
  "beam": {
    "m": 76.8,
    "ft": 252
  },
  "draught": {
    "m": 11.3,
    "ft": 37.1
  },
  "speed": {
    "knots": 30,
    "km_h": 55.6
  }
}
