{
  "id": "fr-dixmude",
  "mmsi": 228784000,
  "name": "Dixmude",
  "proper": "FS Dixmude",
  "comm": "2012-12-27",
  "pennant": "L9015",
  "deck": "DX",
  "type": "helicopter",
  "country": "France",
  "navy": "Marine nationale",
  "class": "Mistral class",
  "home_port": "fr-toulon",
  "img": "https://commons.wikimedia.org/wiki/File:BPC_Dixmude.jpg",
  "displacement": {
    "tons": 21300,
    "tonnes": 21641.8
  },
  "length": {
    "m": 199,
    "ft": 652.9
  },
  "beam": {
    "m": 32,
    "ft": 105
  },
  "draught": {
    "m": 6.3,
    "ft": 20.7
  },
  "speed": {
    "knots": 18.8,
    "km_h": 34.8
  }
}
