{
  "id": "us-kearsarge",
  "mmsi": 368702000,
  "name": "Kearsarge",
  "proper": "USS Kearsarge",
  "comm": "1993-10-16",
  "pennant": "LHD-3",
  "deck": "3",
  "type": "helicopter",
  "country": "United States",
  "navy": "United States Navy",
  "class": "Wasp class",
  "home_port": "us-norfolk",
  "img": "https://commons.wikimedia.org/wiki/File:US_Navy_030604-N-2819P-153_USS_Kearsarge_(LHD-3)_steams_in_the_Gulf_of_Aqaba.jpg",
  "displacement": {
    "tons": 40500,
    "tonnes": 41149.9
  },
  "length": {
    "m": 257,
    "ft": 843.2
  },
  "beam": {
    "m": 42,
    "ft": 137.8
  },
  "draught": {
    "m": 8.1,
    "ft": 26.6
  },
  "speed": {
    "knots": 22,
    "km_h": 40.7
  }
}
