{
  "id": "us-nimitz",
  "mmsi": 303981000,
  "name": "Nimitz",
  "proper": "USS Nimitz",
  "comm": "1975-05-03",
  "pennant": "CVN-68",
  "deck": "68",
  "type": "aircraft",
  "country": "United States",
  "navy": "United States Navy",
  "class": "Nimitz class",
  "home_port": "us-kitsap",
  "img": "https://commons.wikimedia.org/wiki/File:USS_Nimitz_(CVN-68).jpg",
  "displacement": {
    "tons": 100000,
    "tonnes": 101604.7
  },
  "length": {
    "m": 332.8,
    "ft": 1091.9
  },
  "beam": {
    "m": 76.8,
    "ft": 252
  },
  "draught": {
    "m": 11.3,
    "ft": 37.1
  },
  "speed": {
    "knots": 30,
    "km_h": 55.6
  }
}
